{
  "version": "0.1.0",
  "lastReviewed": "{{CURRENT_DATE}}",
  "policy": {
    "valuesAllowed": false,
    "sourceOfTruth": "docs/SECRETS.md",
    "workerRequiredSecretsAlsoLiveIn": ".github/workflows/deploy.yml Verify Worker Secrets step"
  },
  "secrets": [
    { "name": "CLOUDFLARE_API_TOKEN", "required": true, "destinations": ["local", "github-actions"], "owner": "platform" },
    { "name": "CLOUDFLARE_ACCOUNT_ID", "required": true, "destinations": ["local", "github-actions"], "owner": "platform" },
    { "name": "GOOGLE_ANALYTICS_SERVICE_ACCOUNT_JSON", "required": false, "destinations": ["local", "github-actions"], "owner": "growth" },
    { "name": "GOOGLE_SEARCH_CONSOLE_SERVICE_ACCOUNT_JSON", "required": false, "destinations": ["local", "github-actions"], "owner": "growth" }
  ]
}
